{
  "$schema": "https://json-schema.org/draft/2020-12/schema",
  "$id": "https://raw.githubusercontent.com/goun7/tamga-protocol/main/specs/manifest-0.3.0-draft.schema.json",
  "title": "Tamga Protocol manifest - v0.3.0 DRAFT (RFC-008 external-receipt + M6 schema slice; additive, PILOT-PENDING)",
  "type": "object",
  "additionalProperties": false,
  "required": [
    "spec_version",
    "package",
    "runtime",
    "memory",
    "capabilities",
    "signature"
  ],
  "properties": {
    "spec_version": {
      "enum": [
        "0.1.0",
        "0.2.0",
        "0.3.0"
      ]
    },
    "package": {
      "type": "object",
      "additionalProperties": false,
      "required": [
        "name",
        "version",
        "code"
      ],
      "properties": {
        "name": {
          "type": "string",
          "pattern": "^[a-z0-9][a-z0-9-]{2,31}$"
        },
        "version": {
          "type": "string",
          "pattern": "^(0|[1-9]\\d*)\\.(0|[1-9]\\d*)\\.(0|[1-9]\\d*)$"
        },
        "code": {
          "type": "object",
          "additionalProperties": false,
          "required": [
            "wasm_sha256",
            "hash_algo",
            "target"
          ],
          "properties": {
            "wasm_sha256": {
              "type": "string",
              "pattern": "^[a-f0-9]{64}$"
            },
            "hash_algo": {
              "const": "sha256"
            },
            "target": {
              "const": "wasi-0.3/component"
            }
          }
        }
      }
    },
    "runtime": {
      "type": "object",
      "additionalProperties": false,
      "required": [
        "min_proof_level",
        "limits"
      ],
      "properties": {
        "min_proof_level": {
          "enum": [
            "P0",
            "P1",
            "P2"
          ]
        },
        "limits": {
          "type": "object",
          "additionalProperties": false,
          "required": [
            "memory_mb",
            "cpu_ms_per_run",
            "io_mb_per_run"
          ],
          "properties": {
            "memory_mb": {
              "type": "integer",
              "minimum": 16,
              "maximum": 4096
            },
            "cpu_ms_per_run": {
              "type": "integer",
              "minimum": 1,
              "maximum": 60000
            },
            "io_mb_per_run": {
              "type": "integer",
              "minimum": 0,
              "maximum": 1024
            }
          }
        },
        "net": {
          "type": "object",
          "additionalProperties": false,
          "required": [
            "egress",
            "max_bytes_per_run",
            "timeout_s"
          ],
          "properties": {
            "egress": {
              "type": "array",
              "minItems": 1,
              "maxItems": 8,
              "items": {
                "type": "string",
                "pattern": "^[^\\s:]+:(0*[1-9][0-9]{0,3}|0*[1-5][0-9]{4}|0*6[0-4][0-9]{3}|0*65[0-4][0-9]{2}|0*655[0-2][0-9]|0*6553[0-5])$",
                "description": "host:port, port 1..65535; DNS resolution + duplicates are enforced runner-side (fail-closed), not here"
              }
            },
            "max_bytes_per_run": {
              "type": "integer",
              "minimum": 1024,
              "maximum": 8388608,
              "description": "per-run byte cap, 1 KiB..8 MiB (RFC-005A D12c)"
            },
            "timeout_s": {
              "type": "integer",
              "minimum": 1,
              "maximum": 120
            }
          }
        }
      }
    },
    "memory": {
      "type": "object",
      "additionalProperties": false,
      "required": [
        "snapshot_format",
        "crypto_suite"
      ],
      "properties": {
        "snapshot_format": {
          "const": "tamga-snapshot/1"
        },
        "crypto_suite": {
          "const": "XChaCha20-Poly1305"
        }
      }
    },
    "capabilities": {
      "type": "array",
      "uniqueItems": true,
      "maxItems": 5,
      "items": {
        "enum": [
          "fs",
          "net",
          "clock",
          "env",
          "random"
        ]
      }
    },
    "payment": {
      "type": "object",
      "additionalProperties": false,
      "required": [
        "schemes"
      ],
      "properties": {
        "schemes": {
          "type": "array",
          "minItems": 1,
          "items": {
            "const": "tamga-sim/1"
          }
        }
      }
    },
    "signature": {
      "type": "object",
      "additionalProperties": false,
      "required": [
        "algo",
        "key",
        "sig"
      ],
      "properties": {
        "algo": {
          "const": "ed25519"
        },
        "key": {
          "type": "string",
          "pattern": "^[a-f0-9]{64}$"
        },
        "sig": {
          "type": "string",
          "pattern": "^[a-f0-9]{128}$"
        }
      }
    },
    "external_receipt": {
      "type": "object",
      "additionalProperties": false,
      "required": [
        "rail",
        "receipt_id",
        "content_hash"
      ],
      "properties": {
        "rail": {
          "type": "string",
          "pattern": "^[a-z0-9-]{1,24}$"
        },
        "receipt_id": {
          "type": "string",
          "pattern": "^0x[0-9a-f]{64}$"
        },
        "content_hash": {
          "type": "object",
          "additionalProperties": false,
          "required": [
            "alg",
            "hex"
          ],
          "properties": {
            "alg": {
              "enum": [
                "sha256",
                "keccak256"
              ]
            },
            "hex": {
              "type": "string",
              "pattern": "^0x[0-9a-f]{64}$"
            }
          }
        },
        "receipt_uri": {
          "type": "string",
          "pattern": "^https://"
        },
        "retention_note": {
          "type": "string",
          "maxLength": 256
        }
      }
    }
  },
  "description": "RFC-007 v0.2 draft: adds runtime.net (R1, manifest-embedded net declaration, founder-approved 2026-09-07). The v0.1 manifest stays frozen — this draft is ADDITIVE: every 0.1.0 manifest is a valid 0.2.0 manifest. Ledger-side v0.2 additions (delivery_hash {alg,hex} D10; D12 conditional unity) live in RFC-003 §10/§11, not here — receipts are chain records, not manifest fields."
}
