{
 "spec_version": "0.3.0",
 "package": {
  "name": "tamga-ornek-ajani",
  "version": "0.1.0",
  "code": {
   "wasm_sha256": "6129007a280fcee3845532d38e4be3ecf9fddb03809c35a335e0b1b9c2b142a5",
   "hash_algo": "sha256",
   "target": "wasi-0.3/component"
  }
 },
 "runtime": {
  "min_proof_level": "P0",
  "limits": {
   "memory_mb": 128,
   "cpu_ms_per_run": 5000,
   "io_mb_per_run": 10
  }
 },
 "memory": {
  "snapshot_format": "tamga-snapshot/1",
  "crypto_suite": "XChaCha20-Poly1305"
 },
 "capabilities": [
  "clock",
  "random"
 ],
 "payment": {
  "schemes": [
   "tamga-sim/1"
  ]
 },
 "signature": {
  "algo": "ed25519",
  "key": "8f6e44601df69d0c4908bd1134e41c5e3304749c6cdd84593fb26512e9fb6ceb",
  "sig": "98ecf7bb984683c31aeea55485f97eb1f9d909948c26934d647362a66d50578472f10e2d310acf07c53a75c70037b4e67db23f6e463b6ecb556681ac652e0c05"
 },
 "external_receipt": {
  "rail": "X402_UPPER",
  "receipt_id": "0x7e7e7e7e7e7e7e7e7e7e7e7e7e7e7e7e7e7e7e7e7e7e7e7e7e7e7e7e7e7e7e7e",
  "content_hash": {
   "alg": "keccak256",
   "hex": "0x8787878787878787878787878787878787878787878787878787878787878787"
  },
  "receipt_uri": "https://example.org/receipt/0x7e7e7e7e7e7e7e7e7e7e7e7e7e7e7e7e7e7e7e7e7e7e7e7e7e7e7e7e7e7e7e7e",
  "retention_note": "rail retention may expire (404 case)"
 }
}